<?xml version="1.0" encoding="UTF-8"?>
<qy:query xsi:schemaLocation="urn:iso:std:iso:ts:29002:-31:ed-1:tech:xml-schema:query query.xsd" xmlns:xsi="http://www.w3.org/2001/XMLSchema-instance" xmlns:cat="urn:iso:std:iso:ts:29002:-10:ed-1:tech:xml-schema:catalogue" xmlns:val="urn:iso:std:iso:ts:29002:-10:ed-1:tech:xml-schema:value" xmlns:qy="urn:iso:std:iso:ts:29002:-31:ed-1:tech:xml-schema:query" xmlns:bas="urn:iso:std:iso:ts:29002:-4:ed-1:tech:xml-schema:basic">
	<qy:class_ref>0000-.</qy:class_ref>
	<qy:property_ref>0000-.</qy:property_ref>
	<qy:characteristic_data_query_expression>
		<qy:range>
			<qy:property_reference property_ref="0000-."/>
			<qy:min_value>50</qy:min_value>
			<qy:max_value>100</qy:max_value>
			<qy:is_inclusive>true</qy:is_inclusive>
		</qy:range>
	</qy:characteristic_data_query_expression>
</qy:query>
